{
  "contract": "bytedesk.release-qualification/1",
  "schema": {
    "id": "https://schemas.bytedesk.ai/agent-delivery/v1/release-qualification/1.0.0",
    "digest": "sha256:c0888e43794063fe0da249241987b1ca9a99c6f2547d6e98a9803e4dd6396a55"
  },
  "qualificationId": "product-release-1-qualification",
  "productRelease": {
    "repository": "registry.example/product/agent-delivery",
    "digest": "sha256:90e259cfd82c5fdef096adda3ea8b6d4b5a16154ca0a119552d5a963bbe34b88",
    "mediaType": "application/vnd.bytedesk.agent.product-release-manifest.v1+json",
    "size": 8598,
    "trustPolicy": {
      "id": "product-release-v1",
      "digest": "sha256:a80850c38ad05f095146c0075910ced54b678a2975bb92611a83b810292de757"
    }
  },
  "rendererReleases": [
    {
      "repository": "registry.example/product/renderers",
      "digest": "sha256:1cb9521c9d799f132573d67fbd2e5dad69244b2c7bd64dd43ff1c03e8c2c9afd",
      "mediaType": "application/vnd.bytedesk.agent.renderer-release.v1+json",
      "size": 5086,
      "trustPolicy": {
        "id": "product-release-v1",
        "digest": "sha256:a80850c38ad05f095146c0075910ced54b678a2975bb92611a83b810292de757"
      }
    },
    {
      "repository": "registry.example/product/renderers",
      "digest": "sha256:2f1323df48ec52d2e293fb4f80cef4a8398dcb7555113fab7bd0eebd427c03db",
      "mediaType": "application/vnd.bytedesk.agent.renderer-release.v1+json",
      "size": 5459,
      "trustPolicy": {
        "id": "product-release-v1",
        "digest": "sha256:a80850c38ad05f095146c0075910ced54b678a2975bb92611a83b810292de757"
      }
    },
    {
      "repository": "registry.example/product/renderers",
      "digest": "sha256:893672b4d661487e19aae81705da617afce1f400409b5e610fdfa0641ff7934b",
      "mediaType": "application/vnd.bytedesk.agent.renderer-release.v1+json",
      "size": 5458,
      "trustPolicy": {
        "id": "product-release-v1",
        "digest": "sha256:a80850c38ad05f095146c0075910ced54b678a2975bb92611a83b810292de757"
      }
    }
  ],
  "evidence": [
    {
      "repository": "registry.example/product/qualification",
      "digest": "sha256:53ab22385957129b99a84fc5ca9dc027da5ef9da504e1d372d0d4ab04a5ef5b0",
      "mediaType": "application/vnd.bytedesk.agent.release-qualification-evidence.v1+json",
      "size": 6131,
      "trustPolicy": {
        "id": "release-qualification-evidence-v1",
        "digest": "sha256:85c3b7627c1c2d075f7f78dc274c8b9550a7ef773840c5a91a15a2d6f9620256"
      }
    },
    {
      "repository": "registry.example/product/qualification",
      "digest": "sha256:6b909513019affd7dae0fb8057a1a9bd20c4cc06d1a679f6f938453064ecab22",
      "mediaType": "application/vnd.bytedesk.agent.release-qualification-evidence.v1+json",
      "size": 6125,
      "trustPolicy": {
        "id": "release-qualification-evidence-v1",
        "digest": "sha256:85c3b7627c1c2d075f7f78dc274c8b9550a7ef773840c5a91a15a2d6f9620256"
      }
    },
    {
      "repository": "registry.example/product/qualification",
      "digest": "sha256:789703520b82aad842938a77f3295073b222ac1ff8b04150105084dd653122b0",
      "mediaType": "application/vnd.bytedesk.agent.release-qualification-evidence.v1+json",
      "size": 6125,
      "trustPolicy": {
        "id": "release-qualification-evidence-v1",
        "digest": "sha256:85c3b7627c1c2d075f7f78dc274c8b9550a7ef773840c5a91a15a2d6f9620256"
      }
    },
    {
      "repository": "registry.example/product/qualification",
      "digest": "sha256:7c4df89723a99ebdc328c469266ddf24f42d284939b3417e8433a2f33d2ba36c",
      "mediaType": "application/vnd.bytedesk.agent.release-qualification-evidence.v1+json",
      "size": 6113,
      "trustPolicy": {
        "id": "release-qualification-evidence-v1",
        "digest": "sha256:85c3b7627c1c2d075f7f78dc274c8b9550a7ef773840c5a91a15a2d6f9620256"
      }
    },
    {
      "repository": "registry.example/product/qualification",
      "digest": "sha256:7fa84238b5317c2c47e30e430ec49d076d44773b5fdf069c2bd9d273259611a4",
      "mediaType": "application/vnd.bytedesk.agent.release-qualification-evidence.v1+json",
      "size": 6113,
      "trustPolicy": {
        "id": "release-qualification-evidence-v1",
        "digest": "sha256:85c3b7627c1c2d075f7f78dc274c8b9550a7ef773840c5a91a15a2d6f9620256"
      }
    },
    {
      "repository": "registry.example/product/qualification",
      "digest": "sha256:19df5f7ceb3bbb258f1559ed75b3927b0ca6785806d8c3c0f30c66124e32161c",
      "mediaType": "application/vnd.bytedesk.agent.release-qualification-evidence.v1+json",
      "size": 6122,
      "trustPolicy": {
        "id": "release-qualification-evidence-v1",
        "digest": "sha256:85c3b7627c1c2d075f7f78dc274c8b9550a7ef773840c5a91a15a2d6f9620256"
      }
    },
    {
      "repository": "registry.example/product/qualification",
      "digest": "sha256:4f7a4ebd65209d0c457d7b1add49659c7d026d52812ca4ffddac7659ce878a13",
      "mediaType": "application/vnd.bytedesk.agent.release-qualification-evidence.v1+json",
      "size": 6143,
      "trustPolicy": {
        "id": "release-qualification-evidence-v1",
        "digest": "sha256:85c3b7627c1c2d075f7f78dc274c8b9550a7ef773840c5a91a15a2d6f9620256"
      }
    },
    {
      "repository": "registry.example/product/qualification",
      "digest": "sha256:56747c0f9c83ba140ac08ec04a82133f9d3ef615f75f1d3933cfa13814b3c783",
      "mediaType": "application/vnd.bytedesk.agent.release-qualification-evidence.v1+json",
      "size": 6125,
      "trustPolicy": {
        "id": "release-qualification-evidence-v1",
        "digest": "sha256:85c3b7627c1c2d075f7f78dc274c8b9550a7ef773840c5a91a15a2d6f9620256"
      }
    },
    {
      "repository": "registry.example/product/qualification",
      "digest": "sha256:3d94c50c34590fb2d1b509c44052507bf3be90ccd3bdef2f9cb20d1c102759cd",
      "mediaType": "application/vnd.bytedesk.agent.release-qualification-evidence.v1+json",
      "size": 6131,
      "trustPolicy": {
        "id": "release-qualification-evidence-v1",
        "digest": "sha256:85c3b7627c1c2d075f7f78dc274c8b9550a7ef773840c5a91a15a2d6f9620256"
      }
    },
    {
      "repository": "registry.example/product/qualification",
      "digest": "sha256:a5761a472db25d7d2df4443b5da5a9823200fd6838da052c033580bb3e52216b",
      "mediaType": "application/vnd.bytedesk.agent.release-qualification-evidence.v1+json",
      "size": 6159,
      "trustPolicy": {
        "id": "release-qualification-evidence-v1",
        "digest": "sha256:85c3b7627c1c2d075f7f78dc274c8b9550a7ef773840c5a91a15a2d6f9620256"
      }
    },
    {
      "repository": "registry.example/product/qualification",
      "digest": "sha256:4044aad9c0cf4a6432a923236a9b360a769ee1039d5550185f3e66828b0c0cdc",
      "mediaType": "application/vnd.bytedesk.agent.release-qualification-evidence.v1+json",
      "size": 6153,
      "trustPolicy": {
        "id": "release-qualification-evidence-v1",
        "digest": "sha256:85c3b7627c1c2d075f7f78dc274c8b9550a7ef773840c5a91a15a2d6f9620256"
      }
    },
    {
      "repository": "registry.example/product/qualification",
      "digest": "sha256:4e8428fd0c16546671f62ed333dedf673048b557769ba44a712c21e76e31494b",
      "mediaType": "application/vnd.bytedesk.agent.release-qualification-evidence.v1+json",
      "size": 6153,
      "trustPolicy": {
        "id": "release-qualification-evidence-v1",
        "digest": "sha256:85c3b7627c1c2d075f7f78dc274c8b9550a7ef773840c5a91a15a2d6f9620256"
      }
    },
    {
      "repository": "registry.example/product/qualification",
      "digest": "sha256:3ab9787fa4e862e6b55a31cf53a7f9fe2dfb3611d513c371aedb159bb1327158",
      "mediaType": "application/vnd.bytedesk.agent.release-qualification-evidence.v1+json",
      "size": 6183,
      "trustPolicy": {
        "id": "release-qualification-evidence-v1",
        "digest": "sha256:85c3b7627c1c2d075f7f78dc274c8b9550a7ef773840c5a91a15a2d6f9620256"
      }
    },
    {
      "repository": "registry.example/product/qualification",
      "digest": "sha256:e3d7ac4b2ce0b6615f1f9cb42102dfdebd659a022fe91c179a3df51e8d52cc9e",
      "mediaType": "application/vnd.bytedesk.agent.release-qualification-evidence.v1+json",
      "size": 6141,
      "trustPolicy": {
        "id": "release-qualification-evidence-v1",
        "digest": "sha256:85c3b7627c1c2d075f7f78dc274c8b9550a7ef773840c5a91a15a2d6f9620256"
      }
    },
    {
      "repository": "registry.example/product/qualification",
      "digest": "sha256:8d940568c6908480d416cf2dee9927240f1a63b2e89cb00b10c69308502a638c",
      "mediaType": "application/vnd.bytedesk.agent.release-qualification-evidence.v1+json",
      "size": 6141,
      "trustPolicy": {
        "id": "release-qualification-evidence-v1",
        "digest": "sha256:85c3b7627c1c2d075f7f78dc274c8b9550a7ef773840c5a91a15a2d6f9620256"
      }
    },
    {
      "repository": "registry.example/product/qualification",
      "digest": "sha256:11ebc8e57ea9e5365b94e91864cd1cf8e1ae8f921db60d023e05bc97e3b8b3f2",
      "mediaType": "application/vnd.bytedesk.agent.release-qualification-evidence.v1+json",
      "size": 6150,
      "trustPolicy": {
        "id": "release-qualification-evidence-v1",
        "digest": "sha256:85c3b7627c1c2d075f7f78dc274c8b9550a7ef773840c5a91a15a2d6f9620256"
      }
    },
    {
      "repository": "registry.example/product/qualification",
      "digest": "sha256:2710a8bca8b78a958a170439897bc32d8990fd03821b686dc30665e525ea6aa8",
      "mediaType": "application/vnd.bytedesk.agent.release-qualification-evidence.v1+json",
      "size": 6141,
      "trustPolicy": {
        "id": "release-qualification-evidence-v1",
        "digest": "sha256:85c3b7627c1c2d075f7f78dc274c8b9550a7ef773840c5a91a15a2d6f9620256"
      }
    },
    {
      "repository": "registry.example/product/qualification",
      "digest": "sha256:06fcf72a565a841e1018816aa34d247e2d9a4ebb8789e3d10b2151a79f903cbd",
      "mediaType": "application/vnd.bytedesk.agent.release-qualification-evidence.v1+json",
      "size": 6132,